<?xml version="1.0" encoding="UTF-8"?>
<!--Sample XML file generated by XMLSpy v2006 rel. 3 sp1 (http://www.altova.com)-->
<scheduleUploadCheck xmlns:xsi="http://www.w3.org/2001/XMLSchema-instance" xsi:noNamespaceSchemaLocation="Z:\Enterprise model\crew1.6\scheduleUploadCheck.xsd">
	<perkey>SK 10033</perkey>
	<startDate>2007-08-13</startDate>
	<endDate>2007-08-13</endDate>
	<update>Y</update>
	<activity>
		<actSeqNo>-1</actSeqNo>
		<stdLocal>2007-08-13</stdLocal>
		<ctd>2007-08-13T09:30:00Z</ctd>
		<cta>2007-08-13T09:30:00Z</cta>
		<ctd2>2007-08-13T09:30:00Z</ctd2>
		<std>2007-08-13T09:30:00Z</std>
		<sta>2007-08-13T11:30:00Z</sta>
		<stnfr>CPH</stnfr>
		<stnto>LHR</stnto>
		<corrTimeCode> </corrTimeCode>
		<activityType>F</activityType>
		<activityName>SK 501</activityName>
		<origDate>2007-08-13</origDate>
		<dutyCode>L</dutyCode>
		<notLast>-0</notLast>
		<legSeqNo>-1</legSeqNo>
	</activity>
	<activity>
		<actSeqNo>-2</actSeqNo>
		<stdLocal>2007-08-13</stdLocal>
		<ctd>2007-08-13T13:05:00Z</ctd>
		<cta>2007-08-13T15:00:00Z</cta>
		<ctd2>2007-08-13T13:05:00Z</ctd2>
		<std>2007-08-13T13:05:00Z</std>
		<sta>2007-08-13T15:00:00Z</sta>
		<stnfr>LHR</stnfr>
		<stnto>CPH</stnto>
		<corrTimeCode> </corrTimeCode>
		<activityType>F</activityType>
		<activityName>SK 502</activityName>
		<origDate>2007-08-13</origDate>
		<dutyCode>L</dutyCode>
		<notLast>-0</notLast>
		<legSeqNo>-1</legSeqNo>
	</activity>
</scheduleUploadCheck>
